<?xml version="1.0"?>

<!--<!DOCTYPE architecture SYSTEM
        "http://architecturerules.googlecode.com/svn/trunk/src/main/resources/architecture-rules.dtd">-->

<architecture>

    <configuration>

        <sources no-packages="ignore">
            <source not-found="ignore">core\target\classes</source>
            <source not-found="ignore">util\target\classes</source>
            <source not-found="ignore">parent-pom\target\classes</source>
            <source not-found="ignore">web\target\classes</source>
        </sources>

        <cyclicalDependency test="true"/>

    </configuration>


    <rules>

        <rule>
            <id>dao</id>
            <package>
                com.seventytwomiles.pagerank.core.dao
            </package>
            <violations>
                <violation>
                    com.seventytwomiles.pagerank.core.services
                </violation>
                <violation>
                    com.seventytwomiles.pagerank.core.builder
                </violation>
                <violation>
                    com.seventytwomiles.pagerank.util
                </violation>
            </violations>
            <comment>The dao interface package should rely on nothing.</comment>
        </rule>

        <rule>
            <id>strategy</id>
            <package>
                com.seventytwomiles.pagerank.serviceproviders.startegies
            </package>
            <violations>
                <violation>
                    com.seventytwomiles.pagerank.core.services
                </violation>
                <violation>
                    com.seventytwomiles.pagerank.core.dao.hibernate
                </violation>
            </violations>
            <comment>strategies should be as pluggable as possible</comment>
        </rule>

        <rule>
            <id>model</id>
            <package>
                com.seventytwomiles.pagerank.core.model
            </package>
            <violations>
                <violation>
                    com.seventytwomiles.pagerank.core.dao
                </violation>
                <violation>
                    com.seventytwomiles.pagerank.core.dao.hibernate
                </violation>
                <violation>
                    com.seventytwomiles.pagerank.core.services
                </violation>
                <violation>
                    com.seventytwomiles.pagerank.core.strategy
                </violation>
                <violation>
                    com.seventytwomiles.pagerank.core.builder
                </violation>
                <violation>
                    com.seventytwomiles.pagerank.util
                </violation>
            </violations>
            <comment>model should remain competely isolated</comment>
        </rule>

    </rules>

</architecture>


